{
  "schema_version": "0.1",
  "generated_at": "2026-06-02T07:05:26.547451Z",
  "source": {
    "spreadsheet_id": "1gp3jl_DyB8kvxHO7m4YjsCPbFTPGi-XKyqPhGAlTZ60",
    "spreadsheet_url": "https://docs.google.com/spreadsheets/d/1gp3jl_DyB8kvxHO7m4YjsCPbFTPGi-XKyqPhGAlTZ60/edit?ouid=112662517307801676490",
    "title": "[Day 1] 1.0 (from 20250707)",
    "source_artifacts": {
      "live_domain_source_model": "live-domain-source-model.json",
      "live_document_item_grouping_checkpoint": "live-document-item-grouping-checkpoint.json",
      "live_version_breakpoint_detection": "live-version-breakpoint-detection.json",
      "live_formula_result_authority_checkpoint": "live-formula-result-authority-checkpoint.json",
      "live_blocker_resolution_update": "live-blocker-resolution-update.json"
    }
  },
  "authority": {
    "source_document": "live_google_sheet",
    "iteration_status": "completed",
    "semantic_truth": "accepted_local_process_claims_only_metric_equivalence_review_required",
    "shared_ontology_updates": 0
  },
  "corrected_domain_classification": {
    "general_domain_source_count": 0,
    "general_domain_status": "not_selected",
    "rejected_general_domain_sources": [
      "accounting-kr"
    ],
    "local_boundary": "전사레벨 현황 보고 문서",
    "local_boundary_status": "confirmed",
    "reporting_basis": "cash basis; 결제액 기반 운영 현황 보고이며 K-IFRS/K-GAAP 매출 산출물이 아님",
    "operative_domain": "cash_basis_payment_status_operational_reporting"
  },
  "semantic_candidates": [
    {
      "id": "semantic_cash_basis_operational_report",
      "type": "semantic_candidate",
      "status": "accepted",
      "domain_layer": "local_process_semantic",
      "label": "cash-basis payment/status operational report",
      "description": "cash basis; 결제액 기반 운영 현황 보고이며 K-IFRS/K-GAAP 매출 산출물이 아님",
      "gate_outcome": "accepted_process_basis",
      "evidence_refs": [
        "live-blocker-resolution-update.json",
        "live-domain-source-model.json"
      ],
      "review_reasons": []
    },
    {
      "id": "semantic_period_tab_calculation_surface",
      "type": "semantic_candidate",
      "status": "accepted",
      "domain_layer": "local_document_semantic",
      "label": "period-tab calculation surface",
      "description": "3 document item groups have formula/dataflow-backed grouping authority.",
      "gate_outcome": "accepted_structural_semantic_seed",
      "evidence_refs": [
        "live-document-item-grouping-checkpoint.json",
        "live-formula-result-authority-checkpoint.json"
      ],
      "review_reasons": []
    },
    {
      "id": "semantic_revenue_label_as_cash_basis_variant",
      "type": "semantic_candidate",
      "status": "review_required",
      "domain_layer": "local_metric_candidate",
      "label": "visible revenue labels as cash-basis payment metric variants",
      "description": "138 visible surfaces contain 결제/매출/순매출 labels. They must be checked as scoped metric variants before being treated as the same 결제액.",
      "gate_outcome": "metric_equivalence_review_required",
      "evidence_refs": [
        "live-block-candidates.json",
        "live-blocker-resolution-update.json"
      ],
      "review_reasons": [
        "visible_label_differs_from_user_confirmed_basis",
        "metric_equivalence_gate_required"
      ]
    },
    {
      "id": "semantic_fc_data_dependent_report_pipeline",
      "type": "semantic_candidate",
      "status": "blocked",
      "domain_layer": "local_pipeline_semantic",
      "label": "FC_DATA-dependent report pipeline",
      "description": "20 pipeline outputs remain blocked by formula-result/error authority.",
      "gate_outcome": "blocked_formula_result_authority",
      "evidence_refs": [
        "live-formula-result-authority-checkpoint.json"
      ],
      "review_reasons": [
        "formula_result_authority_blocked"
      ]
    },
    {
      "id": "semantic_repeated_workbook_family_evidence",
      "type": "semantic_candidate",
      "status": "review_required",
      "domain_layer": "process_semantic",
      "label": "repeated workbook-family evidence",
      "description": "15 version breakpoints remain review-required before repeated evidence can support shared promotion.",
      "gate_outcome": "version_evidence_review_required",
      "evidence_refs": [
        "live-version-breakpoint-detection.json"
      ],
      "review_reasons": [
        "review_required_version_breakpoints"
      ]
    }
  ],
  "semantic_gate_results": [
    {
      "id": "gate_general_domain_applicability",
      "type": "semantic_gate_result",
      "gate_type": "general_domain_applicability_gate",
      "status": "accepted",
      "message": "No general-domain pack is selected; accounting-kr is excluded for this document.",
      "evidence_refs": [
        "live-domain-source-model.json"
      ]
    },
    {
      "id": "gate_local_boundary",
      "type": "semantic_gate_result",
      "gate_type": "local_boundary_gate",
      "status": "accepted",
      "message": "전사레벨 현황 보고 문서",
      "evidence_refs": [
        "live-domain-source-model.json"
      ]
    },
    {
      "id": "gate_reporting_basis",
      "type": "semantic_gate_result",
      "gate_type": "reporting_basis_gate",
      "status": "accepted",
      "message": "cash basis; 결제액 기반 운영 현황 보고이며 K-IFRS/K-GAAP 매출 산출물이 아님",
      "evidence_refs": [
        "live-blocker-resolution-update.json"
      ]
    },
    {
      "id": "gate_grouping_prerequisite",
      "type": "semantic_gate_result",
      "gate_type": "document_item_grouping_gate",
      "status": "accepted",
      "message": "3 accepted groupings, 126 review-required groupings.",
      "evidence_refs": [
        "live-document-item-grouping-checkpoint.json"
      ]
    },
    {
      "id": "gate_version_evidence",
      "type": "semantic_gate_result",
      "gate_type": "version_breakpoint_gate",
      "status": "review_required",
      "message": "15 version breakpoints require review.",
      "evidence_refs": [
        "live-version-breakpoint-detection.json"
      ]
    },
    {
      "id": "gate_formula_result_authority",
      "type": "semantic_gate_result",
      "gate_type": "formula_result_authority_gate",
      "status": "blocked",
      "message": "3 accepted and 20 blocked pipeline authority results.",
      "evidence_refs": [
        "live-formula-result-authority-checkpoint.json"
      ]
    },
    {
      "id": "gate_metric_equivalence",
      "type": "semantic_gate_result",
      "gate_type": "metric_equivalence_gate",
      "status": "review_required",
      "message": "138 결제/매출/순매출 surfaces require scoped metric equivalence checks.",
      "evidence_refs": [
        "live-block-candidates.json"
      ]
    },
    {
      "id": "gate_shared_promotion",
      "type": "semantic_gate_result",
      "gate_type": "shared_promotion_gate",
      "status": "blocked",
      "message": "Shared ontology updates remain 0 until grouping, version, metric-equivalence, lineage, and human approval gates pass.",
      "evidence_refs": [
        "live-semantic-gate-iteration.json"
      ]
    }
  ],
  "metric_equivalence_checks": [
    {
      "id": "metric_check_visible_net_revenue_or_refund_adjusted_label",
      "type": "metric_equivalence_check",
      "status": "review_required",
      "candidate_parent_label": "결제액",
      "visible_label_bucket": "visible_net_revenue_or_refund_adjusted_label",
      "surface_count": 97,
      "sample_surfaces": [
        {
          "id": "block_26_0601_006",
          "sheet": "26_0601",
          "range": "F20:G25",
          "surface_type": "table_candidate",
          "label": "순매출 (환불 반영)"
        },
        {
          "id": "block_26_0525_004",
          "sheet": "26_0525",
          "range": "B10:K15",
          "surface_type": "section_heading",
          "label": "A. 주간 순매출 및 공헌이익"
        },
        {
          "id": "block_26_0525_006",
          "sheet": "26_0525",
          "range": "F25:K25",
          "surface_type": "text_block",
          "label": "참고 | 24-26년 월 단위 순매출"
        },
        {
          "id": "block_26_0525_007",
          "sheet": "26_0525",
          "range": "F39:K39",
          "surface_type": "table_candidate",
          "label": "표3 | 최근 12주 총 매출 합 (신규 강의, Long Tail 강의 순매출)"
        },
        {
          "id": "block_26_0518_004",
          "sheet": "26_0518",
          "range": "B10:K14",
          "surface_type": "section_heading",
          "label": "A. 주간 순매출 및 공헌이익"
        },
        {
          "id": "block_26_0518_007",
          "sheet": "26_0518",
          "range": "F25:K25",
          "surface_type": "text_block",
          "label": "참고 | 24-26년 월 단위 순매출"
        },
        {
          "id": "block_26_0518_008",
          "sheet": "26_0518",
          "range": "F39:K39",
          "surface_type": "table_candidate",
          "label": "표3 | 최근 12주 총 매출 합 (신규 강의, Long Tail 강의 순매출)"
        },
        {
          "id": "block_26_0511_004",
          "sheet": "26_0511",
          "range": "B10:K14",
          "surface_type": "section_heading",
          "label": "A. 주간 순매출 및 공헌이익"
        },
        {
          "id": "block_26_0511_006",
          "sheet": "26_0511",
          "range": "F25:K25",
          "surface_type": "text_block",
          "label": "참고 | 24-26년 월 단위 순매출"
        },
        {
          "id": "block_26_0511_007",
          "sheet": "26_0511",
          "range": "F39:K39",
          "surface_type": "table_candidate",
          "label": "표3 | 최근 12주 총 매출 합 (신규 강의, Long Tail 강의 순매출)"
        },
        {
          "id": "block_26_0511_009",
          "sheet": "26_0511",
          "range": "F73:K75",
          "surface_type": "text_block",
          "label": "참고 | 주요 비용(강사료+마케팅비)의 순매출 대비 비중 25년 및 26년"
        },
        {
          "id": "block_26_0504_004",
          "sheet": "26_0504",
          "range": "B10:K12",
          "surface_type": "section_heading",
          "label": "A. 주간 순매출 및 공헌이익"
        }
      ],